{
  "schemaVersion": 1,
  "evidenceId": "local-chromium-zoom-reflow-touch-0.50.0",
  "releaseVersion": "0.50.0",
  "gateId": "zoom-reflow-touch",
  "kind": "other",
  "role": "supplemental",
  "collectedAt": "2026-09-25T11:24:31.860Z",
  "outcome": "pass",
  "claims": [],
  "coverage": [
    "320px document-overflow check and mobile-size render candidates"
  ],
  "environment": {
    "runner": "Local Chromium via Chrome DevTools Protocol",
    "browser": "Chrome/144.0.7559.96",
    "userAgent": "Mozilla/5.0 (X11; Linux x86_64) AppleWebKit/537.36 (KHTML, like Gecko) HeadlessChrome/144.0.0.0 Safari/537.36",
    "platform": "linux",
    "arch": "x64",
    "node": "v22.16.0"
  },
  "artifacts": [
    {
      "path": "tests/release/evidence-artifacts/0.50.0/local-chromium/local-chromium-report.json",
      "sha256": "ac1e3794cb04cfdd087659f95010f68f8eca940e049171f0ca3d008071c79798",
      "description": "Machine-readable local Chromium RC report with test results and screenshot hashes."
    }
  ],
  "notes": "Viewport/reflow prerequisite evidence only; not real 200%/400% browser zoom or real touch hardware.",
  "review": {
    "status": "pending",
    "reviewedBy": null,
    "reviewedAt": null,
    "notes": "Supplemental automated evidence; intentionally not gate-closing."
  }
}
