{
  "schemaVersion": 1,
  "evidenceId": "local-chromium-visual-regression-baselines-0.55.0",
  "releaseVersion": "0.55.0",
  "gateId": "visual-regression-baselines",
  "kind": "other",
  "role": "supplemental",
  "collectedAt": "2026-09-28T19:51:34.021Z",
  "outcome": "pass",
  "claims": [],
  "coverage": [
    "Canonical Chromium candidate screenshots captured and hashed"
  ],
  "environment": {
    "runner": "Local Chromium via Chrome DevTools Protocol",
    "browser": "Chrome/153.0.8010.12",
    "userAgent": "Mozilla/5.0 (X11; Linux x86_64) AppleWebKit/537.36 (KHTML, like Gecko) HeadlessChrome/153.0.0.0 Safari/537.36",
    "platform": "linux",
    "arch": "x64",
    "node": "v22.23.2"
  },
  "artifacts": [
    {
      "path": "tests/release/evidence-artifacts/0.55.0/local-chromium/local-chromium-report.json",
      "sha256": "028ca6c96e3aadbabeb343f011a63d3fbda8e71f1fd2ee875d984aa7a1ec368c",
      "description": "Machine-readable local Chromium RC report with test results and screenshot hashes."
    }
  ],
  "notes": "Candidate screenshots only; not human-approved baselines.",
  "review": {
    "status": "pending",
    "reviewedBy": null,
    "reviewedAt": null,
    "notes": "Supplemental automated evidence; intentionally not gate-closing."
  }
}
