{
  "schemaVersion": 1,
  "evidenceId": "local-chromium-forced-colors-high-contrast-0.55.0",
  "releaseVersion": "0.55.0",
  "gateId": "forced-colors-high-contrast",
  "kind": "other",
  "role": "supplemental",
  "collectedAt": "2026-09-29T08:20:56.976Z",
  "outcome": "pass",
  "claims": [],
  "coverage": [
    "Chromium forced-colors and prefers-contrast media emulation"
  ],
  "environment": {
    "runner": "Local Chromium via Chrome DevTools Protocol",
    "browser": "Chrome/153.0.8010.12",
    "userAgent": "Mozilla/5.0 (X11; Linux x86_64) AppleWebKit/537.36 (KHTML, like Gecko) HeadlessChrome/153.0.0.0 Safari/537.36",
    "platform": "linux",
    "arch": "x64",
    "node": "v22.23.2"
  },
  "artifacts": [
    {
      "path": "tests/release/evidence-artifacts/0.55.0/local-chromium/local-chromium-report.json",
      "sha256": "7f47f391d07fb76c6c2d198385c77f2c566afa94d5a12d8b1e50793d52f51218",
      "description": "Machine-readable local Chromium RC report with test results and screenshot hashes."
    }
  ],
  "notes": "Automated media emulation only; not Windows High Contrast/manual review.",
  "review": {
    "status": "pending",
    "reviewedBy": null,
    "reviewedAt": null,
    "notes": "Supplemental automated evidence; intentionally not gate-closing."
  }
}
