{
  "schemaVersion": 1,
  "evidenceId": "visual-regression-baselines-baseline-human-approved-replace-me",
  "releaseVersion": "0.55.0",
  "gateId": "visual-regression-baselines",
  "kind": "visual-review",
  "role": "closing",
  "collectedAt": "REPLACE_WITH_ISO_TIMESTAMP",
  "outcome": "pass",
  "claims": [
    "baseline-human-approved"
  ],
  "environment": {
    "notes": "Describe browser/device/assistive-tech/zoom/high-contrast/review environment."
  },
  "artifacts": [
    {
      "path": "REPLACE_WITH_REPOSITORY_RELATIVE_EVIDENCE_PATH",
      "sha256": "REPLACE_WITH_SHA256",
      "description": "Screenshot, notes, device-cloud export, decision memo, or other supporting evidence."
    }
  ],
  "notes": "Describe what was tested, the result, and any limitations.",
  "review": {
    "status": "pending",
    "reviewedBy": null,
    "reviewedAt": null,
    "notes": "Approval must be deliberate and evidence-based."
  }
}
