{
  "schemaVersion": 1,
  "evidenceId": "local-chromium-desktop-browser-matrix-0.49.0",
  "releaseVersion": "0.49.0",
  "gateId": "desktop-browser-matrix",
  "kind": "other",
  "role": "supplemental",
  "collectedAt": "2026-09-25T11:12:57.147Z",
  "outcome": "pass",
  "claims": [],
  "coverage": [
    "Chrome/144.0.7559.96 local Linux render/smoke/interaction run"
  ],
  "environment": {
    "runner": "Local Chromium via Chrome DevTools Protocol",
    "browser": "Chrome/144.0.7559.96",
    "userAgent": "Mozilla/5.0 (X11; Linux x86_64) AppleWebKit/537.36 (KHTML, like Gecko) HeadlessChrome/144.0.0.0 Safari/537.36",
    "platform": "linux",
    "arch": "x64",
    "node": "v22.16.0"
  },
  "artifacts": [
    {
      "path": "tests/release/evidence-artifacts/0.49.0/local-chromium/local-chromium-report.json",
      "sha256": "5a8995d58fcecc9e2355b7086208bfa4ea7dc33d8b484338a21ff4b646f951e3",
      "description": "Machine-readable local Chromium RC report with test results and screenshot hashes."
    }
  ],
  "notes": "Real local Chromium-engine execution. Supplemental only: Chromium is not treated as branded current Google Chrome, Edge, Firefox, or Safari evidence.",
  "review": {
    "status": "pending",
    "reviewedBy": null,
    "reviewedAt": null,
    "notes": "Supplemental automated evidence; intentionally not gate-closing."
  }
}
